{
  "version": "0.1.0-local-preview",
  "updated": "2026-07-22",
  "locale": "ru",
  "course": {
    "id": "ais-flows-ai-video-course",
    "title": "AIS FLOWS: курс по AI-видео",
    "eyebrow": "Рабочая система обучения",
    "promise": "От идеи до собранного AI-видео",
    "summary": "Пошаговый маршрут для тех, кто хочет подготовить замысел, удержать визуальную логику, сгенерировать управляемые фрагменты и собрать финальный ролик.",
    "audience": "Авторы, AI-креаторы и команды, которым нужен повторяемый процесс вместо одного случайного промпта.",
    "outcome": "К концу маршрута у вас будет комплект рабочих решений: production card, тайминг, референсы, план кадров, промпты, выбранные варианты и план финальной сборки.",
    "status": "draft",
    "status_label": "Рабочий черновик · обновляется",
    "first_lesson_id": "workspace-and-preparation"
  },
  "blocks": [
    {
      "id": 1,
      "slug": "intent-and-preparation",
      "title_ru": "Предподготовка и замысел",
      "summary_ru": "Навести порядок, сформулировать задачу и зафиксировать, что ролик не имеет права потерять.",
      "understand_ru": "Почему AI-видео начинается не с большого промпта, а с ясного замысла и минимального набора входов.",
      "do_ru": "Собрать рабочее место, короткую карточку ролика и подготовительный пакет.",
      "result_ru": "Production card и понятный стартовый набор проекта.",
      "lesson_ids": [
        "workspace-and-preparation",
        "start-with-intent",
        "production-card"
      ],
      "prerequisites": [],
      "unlocks": [
        2
      ]
    },
    {
      "id": 2,
      "slug": "timing-and-visual-control",
      "title_ru": "История, тайминг и визуальный контроль",
      "summary_ru": "Превратить замысел в порядок событий, временную карту и устойчивую систему визуальных опор.",
      "understand_ru": "Чем сценарий отличается от промпта, а тайминг — от списка генераций.",
      "do_ru": "Собрать timing map, shot plan и reference system для повторяющихся сущностей.",
      "result_ru": "Карта времени, план кадров и набор визуальных опор.",
      "lesson_ids": [
        "story-and-timing",
        "references-and-visual-control"
      ],
      "prerequisites": [
        1
      ],
      "unlocks": [
        3
      ]
    },
    {
      "id": 3,
      "slug": "prompts-models-generation",
      "title_ru": "Промпты, модели и видеогенерация",
      "summary_ru": "Выбрать маршрут генерации и превратить подготовленные кадры и сегменты в точные инструкции модели.",
      "understand_ru": "Почему промпт изображения и промпт видео решают разные задачи, и когда нужен text-to-video, image-to-video или reference route.",
      "do_ru": "Подготовить Frame Pack, выбрать режим и написать generator-facing промпты.",
      "result_ru": "Стартовые кадры, промпты и управляемый план генерации draft-вариантов.",
      "lesson_ids": [
        "image-and-video-prompts",
        "generation-routes",
        "prompt-reference-library"
      ],
      "prerequisites": [
        2
      ],
      "unlocks": [
        4
      ]
    },
    {
      "id": 4,
      "slug": "diagnosis-selection-assembly",
      "title_ru": "Диагностика, отбор и финальная сборка",
      "summary_ru": "Проверить варианты, перестать чинить всё подряд и собрать только пригодные фрагменты.",
      "understand_ru": "Как отличить красивый draft от usable take и как формулировать следующий тест после ошибки.",
      "do_ru": "Провести winner gate, описать поломки, собрать монтаж и финальную проверку.",
      "result_ru": "Список winners, план ремонта, монтаж и чек-лист экспорта.",
      "lesson_ids": [
        "failure-diagnosis",
        "final-production"
      ],
      "prerequisites": [
        3
      ],
      "unlocks": [
        5
      ]
    },
    {
      "id": 5,
      "slug": "tools-worksheets-case",
      "title_ru": "Инструменты, рабочие листы и полный кейс",
      "summary_ru": "Собрать среду, использовать рабочие формы и увидеть весь процесс на одном учебном кейсе.",
      "understand_ru": "Какие инструменты нужны конкретному маршруту и зачем рабочие листы снижают стоимость ошибок.",
      "do_ru": "Настроить минимальный tool stack, заполнить листы и пройти каркас полного проекта.",
      "result_ru": "Собственная рабочая система и карта полного производственного прохода.",
      "lesson_ids": [
        "tool-stack",
        "templates-and-worksheets",
        "full-case-study"
      ],
      "prerequisites": [
        4
      ],
      "unlocks": [
        6
      ]
    },
    {
      "id": 6,
      "slug": "packaging-library-practice",
      "title_ru": "Упаковка, библиотека и практический слой",
      "summary_ru": "Сохранить выводы, пользоваться библиотекой как справочником и отделять рабочий курс от будущего продукта.",
      "understand_ru": "Как превращать опыт проекта в повторяемую систему и не выдавать черновик за готовый коммерческий продукт.",
      "do_ru": "Собрать библиотеку выводов, определить следующий практический проход и правила честной упаковки.",
      "result_ru": "Обновляемая личная библиотека и понятный маршрут следующего ролика.",
      "lesson_ids": [
        "course-packaging",
        "source-backed-lessons"
      ],
      "prerequisites": [
        5
      ],
      "unlocks": []
    }
  ],
  "lessons": [
    {
      "id": "workspace-and-preparation",
      "block": 1,
      "order": 1,
      "title_ru": "Рабочее место и предподготовка",
      "status": "draft",
      "type": "do",
      "keywords_ru": [
        "папка проекта",
        "исходники",
        "версии",
        "подготовка"
      ],
      "summary_ru": "Разложить исходники, версии и рабочие материалы так, чтобы производство не начиналось с поиска потерянного файла.",
      "why_ru": "Порядок до генерации снижает повторные прогоны и помогает сохранить лучший результат.",
      "understand_ru": [
        "Какой минимальный набор нужен до первого промпта.",
        "Чем постоянное рабочее место отличается от материалов конкретного ролика."
      ],
      "do_steps_ru": [
        "Создайте папку проекта и разделите исходники, референсы, draft, winners и export.",
        "Запишите длительность, формат и главный объект ролика.",
        "Проверьте, что важные исходники имеют понятные имена и не смешаны с тестами."
      ],
      "check_ru": [
        "Лучший файл можно найти без просмотра всей папки.",
        "Понятно, где лежат исходники и куда сохранять новые варианты."
      ],
      "result_ru": "Подготовленная структура проекта и короткая стартовая карточка.",
      "inputs_ru": [
        "Идея ролика",
        "Доступные исходники",
        "Желаемый формат"
      ],
      "artifact": {
        "label_ru": "Структура папки проекта",
        "status": "not_public",
        "url": null
      },
      "builder_step": "1. Создать папку проекта",
      "prerequisites": [],
      "next_id": "start-with-intent",
      "visibility": "public_preview",
      "source_file": "00A_WORKSPACE_AND_PREPREPARATION.md",
      "source_version": "0.1.0-local-preview",
      "source_sha256": "9194530035249762ebaf9dff45ae5abc7f3074eb6782847cab66724a1f214eed",
      "content_sha256": "9194530035249762ebaf9dff45ae5abc7f3074eb6782847cab66724a1f214eed",
      "human_lesson_url": "./lessons/workspace-and-preparation.html",
      "content_url": "./content/workspace-and-preparation.md",
      "content_json_url": "./content/workspace-and-preparation.json",
      "canonical_human_url": "https://aisflows-home-preview.pages.dev/course/lessons/workspace-and-preparation.html"
    },
    {
      "id": "start-with-intent",
      "block": 1,
      "order": 2,
      "title_ru": "С чего начинается AI-видео",
      "status": "draft",
      "type": "understand",
      "keywords_ru": [
        "идея",
        "замысел",
        "смысл",
        "промпт"
      ],
      "summary_ru": "Понять главный обман старта: хороший ролик начинается с решений о смысле и контроле, а не с магической формулировки.",
      "why_ru": "Без ясного замысла модель начинает сама выбирать режиссуру, ритм и детали, которые для вас важны.",
      "understand_ru": [
        "Что зритель должен увидеть и понять.",
        "Что модель не имеет права менять.",
        "Почему один большой промпт не заменяет производство."
      ],
      "do_steps_ru": [
        "Сформулируйте идею ролика одним предложением.",
        "Запишите главный визуальный образ и финальную мысль.",
        "Назовите три вещи, которые должны оставаться стабильными."
      ],
      "check_ru": [
        "Замысел можно объяснить человеку за 20 секунд.",
        "В формулировке нет списка сервисов вместо смысла ролика."
      ],
      "result_ru": "Короткий замысел и список критичных элементов.",
      "inputs_ru": [
        "Идея или задача",
        "Целевая аудитория",
        "Желаемое впечатление"
      ],
      "artifact": {
        "label_ru": "Карточка замысла",
        "status": "preview_pending",
        "url": null
      },
      "builder_step": "0. Принцип: не начинать с промпта",
      "prerequisites": [
        "workspace-and-preparation"
      ],
      "next_id": "production-card",
      "visibility": "public_preview",
      "source_file": "01_START_HERE.md",
      "source_version": "0.1.0-local-preview",
      "source_sha256": "7674e81244da2198bc4dc5dda04c00800046ac3573daf19e33146fffbe3ebd57",
      "content_sha256": "7674e81244da2198bc4dc5dda04c00800046ac3573daf19e33146fffbe3ebd57",
      "human_lesson_url": "./lessons/start-with-intent.html",
      "content_url": "./content/start-with-intent.md",
      "content_json_url": "./content/start-with-intent.json",
      "canonical_human_url": "https://aisflows-home-preview.pages.dev/course/lessons/start-with-intent.html"
    },
    {
      "id": "production-card",
      "block": 1,
      "order": 3,
      "title_ru": "Production Card до промпта",
      "status": "draft",
      "type": "do",
      "keywords_ru": [
        "production card",
        "подготовительный пакет",